{"$schema":"http://json-schema.org/draft-07/schema#","title":"FluxSkill","type":"object","required":["id","name","category","description","when_to_use","command","platforms","tags","author","version"],"properties":{"id":{"type":"string","pattern":"^[a-z0-9-]+$"},"name":{"type":"string","pattern":"^SKILL-[A-Z0-9-]+$"},"category":{"type":"string","enum":["dev","qa","marketing","ops"]},"description":{"type":"string","minLength":20,"maxLength":200},"when_to_use":{"type":"string","minLength":10,"maxLength":200},"command":{"type":"object","required":["claude_code"],"properties":{"claude_code":{"type":"string"},"antigravity":{"type":"string"},"codex":{"type":"string"},"claude_ai":{"type":"string"},"gemini":{"type":"string"}}},"platforms":{"type":"array","minItems":1,"items":{"type":"string","enum":["Claude Code","AntiGravity","Codex","claude.ai","Gemini","ChatGPT"]}},"tags":{"type":"array","minItems":2,"maxItems":10,"items":{"type":"string"}},"source_path":{"type":"string"},"author":{"type":"string"},"version":{"type":"string","pattern":"^\\d+\\.\\d+\\.\\d+$"},"created_at":{"type":"string","pattern":"^\\d{4}-\\d{2}-\\d{2}$"}}}
