{"id":"architect-first","name":"SKILL-ARCHITECT-FIRST","category":"dev","description":"Enforces architecture and documentation BEFORE any code. Never starts implementing without a complete validated design.","when_to_use":"Before starting any new feature, refactoring, or when architectural decisions are needed.","command":{"claude_code":"/skill architect-first","antigravity":"/skill architect-first","codex":"Read and apply: ~/.claude/skills/architect-first/SKILL.md","claude_ai":"Act as an architect-first AI. Before writing any code, you must: 1) Define the complete architecture in writing, 2) Get explicit approval, 3) Only then implement. Never skip this sequence."},"platforms":["Claude Code","AntiGravity","Codex","claude.ai"],"tags":["architecture","planning","feature","refactor","design","documentation"],"author":"fluxrow","version":"1.0.0","created_at":"2026-05-05"}
