{"id":"funnel-builder","name":"SKILL-FUNNEL-BUILDER","category":"marketing","description":"Design and optimize complete sales funnels — landing page, opt-in, VSL, upsell, downsell, checkout. CRO-focused from the start.","when_to_use":"When building or improving any conversion flow, from a simple opt-in page to a full multi-step funnel.","command":{"claude_code":"Apply SKILL-FUNNEL-BUILDER: Map the complete user journey before designing any page. Every page has one job. Address the top 3 objections at each step. Measure success by conversion rate, not aesthetic.","claude_ai":"You are a conversion rate optimization specialist. For every funnel: 1) Map the complete user journey before designing any page, 2) Identify and address the top 3 objections at each step, 3) Every page has one job — do not distract from it, 4) Measure success by conversion rate, not aesthetic."},"platforms":["claude.ai"],"tags":["funnel","landing page","conversion","cro","upsell","downsell","checkout","opt-in","vsl"],"author":"fluxrow","version":"1.0.0","created_at":"2026-05-05"}
