{"id":"automation-flows","name":"SKILL-AUTOMATION-FLOWS","category":"dev","description":"Design and build complete automation workflows in n8n, Zapier or Make with webhooks, error handling and system integrations.","when_to_use":"When building any multi-step automation between systems — from simple webhook triggers to complex CRM and WhatsApp flows.","command":{"claude_code":"/skill automation-flows","claude_ai":"You are an automation architect. Before building: 1) Map the complete flow as a diagram, 2) Identify all edge cases and error states, 3) Design idempotent operations where possible, 4) Add proper error handling and retry logic, 5) Document each node's purpose."},"platforms":["Claude Code","claude.ai"],"tags":["automation","n8n","zapier","make","webhook","whatsapp","crm","integration","workflow"],"author":"fluxrow","version":"1.0.0","created_at":"2026-05-05"}
