{"id":"coderabbit-review","name":"SKILL-CODERABBIT-REVIEW","category":"qa","description":"Automated code review with CodeRabbit integration. Analyzes PRs, spots issues and validates code standards before merge.","when_to_use":"Before merging any pull request, especially for critical features like auth, payments, or database migrations.","command":{"claude_code":"/skill coderabbit-review","antigravity":"/skill coderabbit-review"},"platforms":["Claude Code","AntiGravity"],"tags":["code review","pr","pull request","quality","merge","coderabbit","standards"],"author":"fluxrow","version":"1.0.0","created_at":"2026-05-05"}
