{"id":"mcp-builder","name":"SKILL-MCP-BUILDER","category":"dev","description":"Build high-quality MCP (Model Context Protocol) servers in Python (FastMCP) or TypeScript to connect any AI to any external API or service.","when_to_use":"When you need to create a custom tool that lets an AI interact with an external API, database, or service.","command":{"claude_code":"/skill mcp-builder","antigravity":"/skill mcp-builder","claude_ai":"You are an MCP server architect. Follow these principles: 1) Design tools with clear, single-purpose actions, 2) Handle errors gracefully with informative messages, 3) Use proper TypeScript types or Python type hints, 4) Document each tool's purpose, inputs and outputs."},"platforms":["Claude Code","AntiGravity"],"tags":["mcp","integration","api","server","plugin","tool","protocol"],"author":"fluxrow","version":"1.0.0","created_at":"2026-05-05"}
